{
  "callback_id": "submit_create_tes_event",
  "title": { "type": "plain_text", "text": "Create TES Event" },
  "submit": { "type": "plain_text", "text": "Create" },
  "blocks": [
    {
      "type": "input",
      "block_id": "project_name",
      "label": { "type": "plain_text", "text": "Project Name" },
      "element": { "type": "plain_text_input", "action_id": "value" }
    },
    {
      "type": "input",
      "block_id": "account",
      "label": { "type": "plain_text", "text": "Account" },
      "element": { "type": "plain_text_input", "action_id": "value" }
    },
    {
      "type": "input",
      "block_id": "salesforce_url",
      "label": { "type": "plain_text", "text": "Salesforce Opportunity URL" },
      "element": { "type": "plain_text_input", "action_id": "value" }
    },
    {
      "type": "input",
      "block_id": "members",
      "label": { "type": "plain_text", "text": "Members" },
      "element": { "type": "multi_users_select", "action_id": "value" }
    },
    {
      "type": "input",
      "block_id": "context_notes",
      "label": { "type": "plain_text", "text": "Context Notes" },
      "optional": true,
      "element": {
        "type": "plain_text_input",
        "action_id": "value",
        "multiline": true
      }
    }
  ],
  "contract": {
    "block_ids": [
      "project_name",
      "account",
      "salesforce_url",
      "members",
      "context_notes"
    ]
  }
}
